{
  "run_id": "RUN-M4-EXAMPLE",
  "form_id": "PUB-M4-D03",
  "level": "M4",
  "benchmark_version": "0.5",
  "model_hash": "sha256:demo",
  "harness_hash": "sha256:demo",
  "memory_manifest_hash": "sha256:demo",
  "difficulty_vector": {
    "records": 120,
    "conflicts": 6,
    "corruptions": 4,
    "clutter_ratio": 0.7,
    "capacity_pressure": 0.4
  },
  "metrics": {
    "repair_precision": 0.91,
    "q_conf": 0.9,
    "harmful_prune_rate": 0.03,
    "q_recover": 0.95,
    "protected_retention_drop": 0.02
  },
  "thresholds": {
    "repair_precision_min": 0.8,
    "q_conf_min": 0.8,
    "harmful_prune_rate_max": 0.1,
    "q_recover_min": 0.8,
    "protected_retention_drop_max": 0.1
  },
  "uncertainty_rule": {
    "development_example_only": true
  },
  "control_result": {
    "passed": true
  },
  "retention": {
    "M0": true,
    "M1": true,
    "M2": true,
    "M3": true
  },
  "verifier": {
    "independent": true,
    "id": "dev-oracle"
  },
  "promotion": {
    "accepted": true,
    "development_only": true
  }
}